{
  "$schema": "https://json-schema.org/draft/2020-12/schema",
  "$id": "news.schema.json",
  "title": "Neon Compass News Item",
  "type": "object",
  "required": ["id", "category", "title", "body", "publishedAt", "status", "sources", "confidence"],
  "additionalProperties": false,
  "properties": {
    "id": { "type": "string", "pattern": "^news_[a-z0-9_]+$" },
    "category": {
      "enum": ["announcement", "patch", "event", "guide", "business", "community"],
      "description": "Doit rester aligné sur NewsCategory (NeonCompass/Core/News/NewsItem.swift). Le décodage y est tolérant depuis l'élargissement des rubriques — une valeur inconnue retombe sur `announcement` au lieu de faire échouer le fragment entier — mais ce schéma reste la liste de référence : publier une rubrique hors de cette liste ferait afficher la mauvaise pastille aux clients déjà installés."
    },
    "game": {
      "enum": ["leonida", "gtav"],
      "description": "Jeu concerné : `leonida` = celui à venir, `gtav` = celui en ligne actuel. Même vocabulaire que MapGame côté app. Absent = `leonida`, ce qui correspond aux entrées publiées avant l'ouverture du fil aux deux jeux."
    },
    "title": { "$ref": "#/$defs/localized" },
    "body": { "$ref": "#/$defs/localized" },
    "publishedAt": {
      "type": "string",
      "pattern": "^\\d{4}-\\d{2}-\\d{2}$",
      "description": "Date ISO courte, jamais un horodatage : FeedModel trie par comparaison de chaînes (plan 3d, tâche 1). Un format autre casserait l'ordre du fil sans lever d'erreur."
    },
    "status": { "enum": ["draft", "published"] },
    "sources": {
      "type": "array",
      "minItems": 1,
      "items": { "type": "string" }
    },
    "confidence": {
      "enum": ["confirmed-official", "multi-source", "single-source", "rumor"],
      "description": "Reprise telle quelle du fait d’inbox. Gouverne la publication (check-publishable) : une rumeur ne part pas dans le fil. Affiché dans la vue de détail depuis le 2026-07-29 — un lecteur de ce fil veut savoir ce que vaut l’information."
    },
    "processedFrom": {
      "type": "string",
      "description": "Clé d'identité du fait d'origine. C'est ce qui rend le run hebdomadaire idempotent : un fait déjà transformé se réapparie sur son item au lieu d'en créer un second."
    },
    "sourceClaim": {
      "type": "string",
      "description": "Le fait brut, conservé pour la relecture humaine. Jamais affiché : il cite ses sources mot pour mot, marques déposées comprises, ce que title/body n'ont pas le droit de faire."
    },
    "needsRewrite": {
      "type": "boolean",
      "description": "Squelette posé par `pull-news`, pas encore rédigé. check-publishable refuse de le publier tant que le drapeau est là."
    }
  },
  "$defs": {
    "localized": {
      "type": "object",
      "required": ["en"],
      "additionalProperties": false,
      "properties": {
        "en": { "type": "string", "minLength": 1 },
        "fr": { "type": "string" },
        "es": { "type": "string" },
        "it": { "type": "string" },
        "de": { "type": "string" }
      }
    }
  }
}
