{
  "id": "news_a55c3e37",
  "category": "announcement",
  "game": "gtav",
  "title": {
    "fr": "Le scénariste historique du studio revient sur un DLC solo jamais sorti",
    "en": "The studio's longtime writer revisits a scrapped solo DLC",
    "es": "El guionista histórico del estudio recuerda un DLC para un jugador nunca publicado",
    "it": "Lo storico sceneggiatore dello studio torna su un DLC single player mai uscito",
    "de": "Der langjährige Autor des Studios spricht über ein nie erschienenes Solo-DLC"
  },
  "body": {
    "fr": "Le cofondateur et ancien scénariste principal du studio a expliqué fin 2025, sur un podcast, qu'un contenu solo mettant en scène Trevor en agent secret était achevé à environ moitié avant d'être annulé. Les ressources libérées ont servi à un autre jeu du studio, et non au mode en ligne comme le prétend une rumeur qui refait régulièrement surface.",
    "en": "The studio's co-founder and former lead writer explained late in 2025, on a podcast, that a solo storyline putting Trevor undercover as a secret agent was roughly half-finished when it was cancelled. The freed-up resources went to another of the studio's games, not to the online mode as a recurring rumor claims.",
    "es": "El cofundador y antiguo guionista principal del estudio explicó a finales de 2025, en un pódcast, que un contenido para un jugador con Trevor como agente secreto estaba terminado en torno a la mitad antes de cancelarse. Los recursos liberados se destinaron a otro juego del estudio, y no al modo en línea, como sostiene un rumor que reaparece con regularidad.",
    "it": "Il cofondatore ed ex sceneggiatore principale dello studio ha spiegato a fine 2025, in un podcast, che un contenuto per giocatore singolo con Trevor nei panni di un agente segreto era completo circa a metà prima di essere annullato. Le risorse liberate sono servite a un altro gioco dello studio, e non alla modalità online come sostiene una voce che riemerge regolarmente.",
    "de": "Der Mitgründer und frühere Chefautor des Studios erklärte Ende 2025 in einem Podcast, ein Solo-Inhalt mit Trevor als Geheimagent sei etwa zur Hälfte fertig gewesen, bevor er gestrichen wurde. Die frei gewordenen Mittel flossen in ein anderes Spiel des Studios — nicht in den Online-Modus, wie ein regelmäßig wiederkehrendes Gerücht behauptet."
  },
  "publishedAt": "2026-08-04",
  "status": "draft",
  "sources": [
    "https://www.gtaboom.com/the-truth-about-every-game-rockstar-quietly-killed-for-gta-ffee"
  ],
  "confidence": "single-source",
  "processedFrom": "inbox:news:74896bbf604b",
  "sourceClaim": "Dan Houser, cofondateur et ancien scénariste principal du studio, a expliqué sur le podcast de Lex Fridman fin 2025 que le contenu solo abandonné de GTA V mettant en scène Trevor comme agent secret était achevé à environ moitié lorsqu'il a été annulé, la capacité ainsi libérée ayant servi à produire Red Dead Redemption 2 plutôt que d'avoir été sacrifiée au profit du mode en ligne comme le prétend une rumeur qui refait régulièrement surface."
}
