{
  "id": "news_f9e207b5",
  "category": "patch",
  "game": "gtav",
  "title": {
    "fr": "Mise à jour hebdomadaire : une supercar aux couleurs de la police",
    "en": "Weekly update: a police-liveried supercar"
  },
  "body": {
    "fr": "Du 23 au 29 juillet : mise en vente d'une supercar en livrée policière, passage d'un autre véhicule d'une exclusivité d'abonnement à la vente générale, et une série de bonus sur les véhicules.",
    "en": "From July 23 to 29: a police-liveried supercar goes on sale, another vehicle moves from a subscription exclusive to general sale, and a run of vehicle bonuses is live."
  },
  "publishedAt": "2026-07-23",
  "status": "published",
  "sources": [
    "https://www.gtaboom.com/gta-online-july-pegassi-ignus-pursuit-update-f4d9"
  ],
  "confidence": "confirmed-official",
  "processedFrom": "inbox:news:d86636582b4b",
  "sourceClaim": "La mise à jour hebdomadaire du jeu en ligne, active du 23 au 29 juillet 2026, met en vente une supercar aux couleurs de la police, fait passer un autre véhicule d'une exclusivité d'abonnement à la vente générale, et applique une série de bonus sur les véhicules."
}
