{
  "id": "news_c1f0807d",
  "category": "announcement",
  "game": "leonida",
  "title": {
    "fr": "Prévisions de revenus déposées : 8 à 8,2 milliards de dollars",
    "en": "Revenue guidance filed: $8 to $8.2 billion"
  },
  "body": {
    "fr": "L'éditeur a déposé auprès du régulateur boursier américain une prévision de revenus nets de 8 à 8,2 milliards de dollars pour son exercice 2027. La presse spécialisée y lit un engagement financier qui renforce la crédibilité de la date du 19 novembre.",
    "en": "The publisher filed net revenue guidance of $8 to $8.2 billion for fiscal 2027 with the US securities regulator. Specialist press reads it as a financial commitment that strengthens the credibility of the November 19 date."
  },
  "publishedAt": "2026-07-27",
  "status": "published",
  "sources": [
    "https://www.gtaboom.com/no-more-delays-take-two-has-filed-the-number-that-locks-gta-6-to-november-db88"
  ],
  "confidence": "multi-source",
  "processedFrom": "inbox:news:ed76add0d47d",
  "sourceClaim": "Take-Two a déposé auprès du régulateur boursier américain des prévisions de revenus nets compris entre 8 et 8,2 milliards de dollars pour son exercice fiscal 2027, un chiffre que la presse spécialisée interprète comme un engagement financier renforçant la crédibilité de la date de sortie du 19 novembre 2026."
}
